{
  "formatVersion": "0.4",
  "recipeId": "recipe-example",
  "title": "Two-piece Avatar",
  "editorVersion": "2022.3.22f1c1",
  "materials": [
    {
      "id": "m-aaaaaaaaaaaaaaaaaaaaaaaaaaaaaaaaaaaaaaaaaaaaaaaaaaaaaaaaaaaaaaaa",
      "packageName": "Avatar.unitypackage",
      "sha256": "aaaaaaaaaaaaaaaaaaaaaaaaaaaaaaaaaaaaaaaaaaaaaaaaaaaaaaaaaaaaaaaa"
    },
    {
      "id": "m-bbbbbbbbbbbbbbbbbbbbbbbbbbbbbbbbbbbbbbbbbbbbbbbbbbbbbbbbbbbbbbbb",
      "packageName": "Coat.unitypackage",
      "sha256": "bbbbbbbbbbbbbbbbbbbbbbbbbbbbbbbbbbbbbbbbbbbbbbbbbbbbbbbbbbbbbbbb"
    }
  ],
  "avatar": {
    "materialId": "m-aaaaaaaaaaaaaaaaaaaaaaaaaaaaaaaaaaaaaaaaaaaaaaaaaaaaaaaaaaaaaaaa",
    "prefabPath": "Assets/Avatar.prefab"
  },
  "outfits": [
    {
      "materialId": "m-bbbbbbbbbbbbbbbbbbbbbbbbbbbbbbbbbbbbbbbbbbbbbbbbbbbbbbbbbbbbbbbb",
      "prefabPath": "Assets/Coat.prefab",
      "mode": "merge_armature",
      "bone": "",
      "toggleName": "Coat",
      "active": true
    }
  ],
  "packages": {
    "com.vrchat.avatars": "3.10.5",
    "nadena.dev.modular-avatar": "1.18.7"
  },
  "adjustments": {
    "lighting": [
      {
        "material": "Assets/Outfit/Coat.mat",
        "min": "0.1",
        "max": "1"
      }
    ],
    "sdkFixes": [
      "This avatar has no pipeline manager component."
    ]
  }
}
